{"Ajax": [4, "/categories/ajax/", {"posts": [{"date": "08/13/2015", "isodate": "2015-08-13T00:00:00-04:00", "title": "Possible Ajax Error Code and Reasons", "url": "/posts/2015/JavaScript/possible-ajax-error-code-and-reasons/"}, {"date": "08/05/2015", "isodate": "2015-08-05T00:00:00-04:00", "title": "RequestDispacher and Redirection in Java Web App", "url": "/posts/2015/Java/requestdispacher-redirection-in-java/"}, {"date": "08/03/2015", "isodate": "2015-08-03T00:00:00-04:00", "title": "Ajax and Java Servlet", "url": "/posts/2015/Java/ajax-and-java-servlet/"}, {"date": "01/13/2015", "isodate": "2015-01-13T00:00:00-05:00", "title": "Ajax and Spring MVC Controller", "url": "/posts/2015/Java/ajax-and-spring-mvc-controller/"}]}], "Algorithm": [5, "/categories/algorithm/", {"posts": [{"date": "07/05/2016", "isodate": "2016-07-05T00:00:00-04:00", "title": "Reading Note - Algorithm Analysis", "url": "/posts/2016/Algorithm/reading-note-algorithm-analysis/"}, {"date": "09/11/2015", "isodate": "2015-09-11T00:00:00-04:00", "title": "Algorithm and Data Structure Basics - Sorting", "url": "/posts/2015/Algorithm%20Data%20Structure/algorithm-and-data-structure-basics-sorting/"}, {"date": "09/03/2015", "isodate": "2015-09-03T00:00:00-04:00", "title": "Algorithm and Data Structure Basics - Heap", "url": "/posts/2015/Algorithm%20Data%20Structure/algorithm-and-data-structure-basics-heap/"}, {"date": "09/02/2015", "isodate": "2015-09-02T00:00:00-04:00", "title": "Algorithm and Data Structure Basics - Recursion", "url": "/posts/2015/Algorithm%20Data%20Structure/algorithm-and-data-structure-basics-recursion/"}, {"date": "09/02/2015", "isodate": "2015-09-02T00:00:00-04:00", "title": "Algorithm and Data Structure Basics - Linked List", "url": "/posts/2015/Algorithm%20Data%20Structure/algorithm-and-data-structure-basics-linkedlist/"}, {"date": "09/01/2015", "isodate": "2015-09-01T00:00:00-04:00", "title": "Algorithm and Data Structure Basics - Dynamic Programming", "url": "/posts/2015/Algorithm%20Data%20Structure/algorithm-and-data-structure-basics-dynamic-programming/"}]}], "Amazon EC2": [1, "/categories/amazon-ec2/", {"posts": [{"date": "01/13/2015", "isodate": "2015-01-13T00:00:00-05:00", "title": "Use Amazon EC2 to Host IPython Notebook", "url": "/posts/2015/Data%20Science/use-amazon-ec2-to-host-ipython-notebook/"}]}], "Android": [1, "/categories/android/", {"posts": [{"date": "01/13/2015", "isodate": "2015-01-13T00:00:00-05:00", "title": "Reading Note for Andorid Development Guide Part I", "url": "/posts/2014/reading-note-android-I/"}]}], "AngularJS": [1, "/categories/angularjs/", {"posts": [{"date": "08/16/2016", "isodate": "2016-08-16T00:00:00-04:00", "title": "AngularJS 2 Study Note (Continually Update)", "url": "/posts/2016/JavaScript/angularjs-2-study-note/"}, {"date": "08/11/2015", "isodate": "2015-08-11T00:00:00-04:00", "title": "AngularJS Basics", "url": "/posts/2015/JavaScript/angularjs-basics/"}]}], "Big Data": [1, "/categories/big-data/", {"posts": [{"date": "08/10/2015", "isodate": "2015-08-10T00:00:00-04:00", "title": "SparkSQL Basics", "url": "/posts/2015/Data%20Science/sparksql-basics/"}]}], "Bootstrap3": [5, "/categories/bootstrap3/", {"posts": [{"date": "07/09/2015", "isodate": "2015-07-09T00:00:00-04:00", "title": "Bootstrap 3 Sticky Footer by Martin Bean and Ryan Fait", "url": "/posts/2015/Front%20End/bootstrap3_sticky_footer/"}, {"date": "06/04/2015", "isodate": "2015-06-04T00:00:00-04:00", "title": "Collection of Tips for Creating/Controlling Dropdown on Web Page", "url": "/posts/2015/JavaScript/create-controll-dropdown/"}, {"date": "01/13/2015", "isodate": "2015-01-13T00:00:00-05:00", "title": "JavaScript Library Experience: FullCalendar", "url": "/posts/2015/JavaScript/javascript-library-experience-fullcalendar/"}, {"date": "12/10/2014", "isodate": "2014-12-10T00:00:00-05:00", "title": "Bootstrap3 Tips CONTINUALLY UPDATE", "url": "/posts/2015/Front%20End/bootstrap3-tricks/"}, {"date": "12/10/2014", "isodate": "2014-12-10T00:00:00-05:00", "title": "Bootstrap3 API Reading Notes", "url": "/posts/2014/bootstrap3-api-reading-notes/"}]}], "Business": [4, "/categories/business/", {"posts": [{"date": "05/30/2017", "isodate": "2017-05-30T00:00:00-04:00", "title": "(In Chinese) \u7a77\u67e5\u7406\u5b9d\u5178-\u9605\u8bfb\u6458\u62843\uff08\u8d22\u62a5\uff09", "url": "/posts/2017/book/chinese-poor-charlies-almanack-3/"}, {"date": "05/21/2017", "isodate": "2017-05-21T00:00:00-04:00", "title": "(In Chinese) \u7a77\u67e5\u7406\u5b9d\u5178-\u9605\u8bfb\u6458\u62841 \uff08\u4f01\u4e1a\u4e0e\u6295\u8d44\uff09", "url": "/posts/2017/book/chinese-poor-charlies-almanack-1/"}, {"date": "05/21/2017", "isodate": "2017-05-21T00:00:00-04:00", "title": "(In Chinese) \u7a77\u67e5\u7406\u5b9d\u5178-\u9605\u8bfb\u6458\u62842 \uff08\u4e2a\u4eba\u53d1\u5c55\uff09", "url": "/posts/2017/book/chinese-poor-charlies-almanack-2/"}, {"date": "02/20/2017", "isodate": "2017-02-20T00:00:00-05:00", "title": "(In Chinese) \u5bcc\u7238\u7238\u7a77\u7238\u7238-\u9605\u8bfb\u6458\u6284", "url": "/posts/2017/book/chinese-rich-data-poor-dad/"}]}], "CDN": [1, "/categories/cdn/", {"posts": [{"date": "01/13/2015", "isodate": "2015-01-13T00:00:00-05:00", "title": "The Benefit of Hosting Content Library with CDN", "url": "/posts/2014/benefit-of-hosting-content-library-with-CDN/"}]}], "CSS": [5, "/categories/css/", {"posts": [{"date": "01/20/2016", "isodate": "2016-01-20T00:00:00-05:00", "title": "LESS Tutorials Notes", "url": "/posts/2016/Front%20End/less_tutorials_notes/"}, {"date": "07/09/2015", "isodate": "2015-07-09T00:00:00-04:00", "title": "Bootstrap 3 Sticky Footer by Martin Bean and Ryan Fait", "url": "/posts/2015/Front%20End/bootstrap3_sticky_footer/"}, {"date": "06/04/2015", "isodate": "2015-06-04T00:00:00-04:00", "title": "Collection of Tips for Creating/Controlling Dropdown on Web Page", "url": "/posts/2015/JavaScript/create-controll-dropdown/"}, {"date": "01/13/2015", "isodate": "2015-01-13T00:00:00-05:00", "title": "SASS Q&A and Tips CONTINUALLY UPDATE", "url": "/posts/2015/Front%20End/sass-qa-and-tips/"}, {"date": "12/10/2014", "isodate": "2014-12-10T00:00:00-05:00", "title": "Bootstrap3 Tips CONTINUALLY UPDATE", "url": "/posts/2015/Front%20End/bootstrap3-tricks/"}, {"date": "12/10/2014", "isodate": "2014-12-10T00:00:00-05:00", "title": "Bootstrap3 API Reading Notes", "url": "/posts/2014/bootstrap3-api-reading-notes/"}]}], "CSS3": [2, "/categories/css3/", {"posts": [{"date": "07/27/2016", "isodate": "2016-07-27T00:00:00-04:00", "title": "Quick Note about Box-Sizing/Box-Shadow", "url": "/posts/2016/Front%20End/quick-note-about-box-box-shadow/"}, {"date": "07/18/2016", "isodate": "2016-07-18T00:00:00-04:00", "title": "Learning Note - CSS Transitions and Transforms (Lynda.com)", "url": "/posts/2016/Front%20End/learning-note-css-transitions-and-transforms/"}]}], "Case Journal": [8, "/categories/case-journal/", {"posts": [{"date": "09/16/2018", "isodate": "2018-09-16T00:00:00-04:00", "title": "(Updating) How to Present a Case", "url": "/posts/2018/business/how-to-present-a-case/"}, {"date": "09/14/2018", "isodate": "2018-09-14T00:00:00-04:00", "title": "(Updating) Consulting Cases - Useful Data Knowledge Base", "url": "/posts/2018/consulting/consulting-cases-useful-data-knowledge-base/"}, {"date": "09/14/2018", "isodate": "2018-09-14T00:00:00-04:00", "title": "(Updating) Consulting Cases - Product Differentiation", "url": "/posts/2018/consulting/consulting-cases-product-differentiation/"}, {"date": "09/14/2018", "isodate": "2018-09-14T00:00:00-04:00", "title": "(Updating) Consulting Cases - New Market/M&A", "url": "/posts/2018/consulting/consulting-cases-new-martket-m-%26-a/"}, {"date": "09/14/2018", "isodate": "2018-09-14T00:00:00-04:00", "title": "(Updating) Consulting Cases - Market Share", "url": "/posts/2018/consulting/consulting-cases-market-share/"}, {"date": "09/14/2018", "isodate": "2018-09-14T00:00:00-04:00", "title": "(Updating) Consulting Cases - Investment", "url": "/posts/2018/consulting/consulting-cases-investment/"}, {"date": "09/14/2018", "isodate": "2018-09-14T00:00:00-04:00", "title": "Case of Make Profit - Berkley 2006 5.13. Bicycle Manufacturer", "url": "/posts/2018/consulting/case-of-make-profit-berkley-bicyle-manufacturer/"}, {"date": "08/19/2018", "isodate": "2018-08-19T00:00:00-04:00", "title": "Case Practice - Sample Case Interview Walkthrough from Management Consulted", "url": "/posts/2018/consulting/case-practice-sample-case-interview-walkthrough-mc/"}]}], "Chinese": [14, "/categories/chinese/", {"posts": [{"date": "07/11/2018", "isodate": "2018-07-11T00:00:00-04:00", "title": "(Chinese) Highlights for Fully Engaged! Using the Practicing Mind in Daily Life written by Thomas M. Sterner", "url": "/posts/2018/book/highlights-for-fully-engaged/"}, {"date": "07/10/2018", "isodate": "2018-07-10T00:00:00-04:00", "title": "(Chinese) Highlights for \u79c1\u306f\u3044\u304f\u3089?(\u7cbe\u51c6\u52aa\u529b) written by Mahito Noguchi(\u91ce\u53e3\u771f\u4eba)", "url": "/posts/2018/book/highlights-for-jingzhunmuli/"}, {"date": "07/06/2018", "isodate": "2018-07-06T00:00:00-04:00", "title": "(Chinese) Highlights for \u201cScarcity: Why Having Too Little Means So Much\u201d by Sendhil Mullainathan & Elddar Shafir", "url": "/posts/2018/book/highlights-for-scarcity/"}, {"date": "03/18/2018", "isodate": "2018-03-18T00:00:00-04:00", "title": "(Chinese) Highlights for \u201cThe Minto Pyramid Principle: Logic in Writing, Thinking, & Problem Solving/\u91d1\u5b57\u5854\u539f\u7406\u201d by Barbara Minto", "url": "/posts/2018/business/hightlights-for-the-minto-pyramid-principle/"}, {"date": "01/31/2018", "isodate": "2018-01-31T00:00:00-05:00", "title": "(In Chinese) \u6392\u5217\u7ec4\u5408\u7b80\u5355\u7b14\u8bb0/A hand-writing brief note about permutation and combination", "url": "/posts/2018/math/chinese-permutation-combination-brief-note/"}, {"date": "01/18/2018", "isodate": "2018-01-18T00:00:00-05:00", "title": "(In Chinese) \u5c0f\u72d7\u94b1\u94b1\u9605\u8bfb\u6458\u6284| Highlight of 'Money Oder Das 1 X 1 Des Geldes' by Bodo Shafer", "url": "/posts/2018/book/highlight-of-money-oder-das-1-X-1-des-geldes-by-bodo-shafer/"}, {"date": "10/08/2017", "isodate": "2017-10-08T00:00:00-04:00", "title": "(Chinese) Kindle Highlights for \u8aad\u66f8\u306f1\u518a\u306e\u30ce\u30fc\u30c8\u306b\u307e\u3068\u3081\u306a\u3055\u3044 (How to read a book effectively) by \u5965\u91ce\u5ba3\u4e4b", "url": "/posts/2017/book/kindle-hightlights-for-how-to-read-a-book-effectively/"}, {"date": "06/25/2017", "isodate": "2017-06-25T00:00:00-04:00", "title": "(In Chinese) \u98ce\u683c\u7684\u8981\u7d20-\u9605\u8bfb\u6458\u6284 (The Elements of Style - Reading Note)", "url": "/posts/2017/book/chinese-the-element-of-style-reading-note/"}, {"date": "05/30/2017", "isodate": "2017-05-30T00:00:00-04:00", "title": "(In Chinese) \u7a77\u67e5\u7406\u5b9d\u5178-\u9605\u8bfb\u6458\u62843\uff08\u8d22\u62a5\uff09", "url": "/posts/2017/book/chinese-poor-charlies-almanack-3/"}, {"date": "05/21/2017", "isodate": "2017-05-21T00:00:00-04:00", "title": "(In Chinese) \u7a77\u67e5\u7406\u5b9d\u5178-\u9605\u8bfb\u6458\u62841 \uff08\u4f01\u4e1a\u4e0e\u6295\u8d44\uff09", "url": "/posts/2017/book/chinese-poor-charlies-almanack-1/"}, {"date": "05/21/2017", "isodate": "2017-05-21T00:00:00-04:00", "title": "(In Chinese) \u7a77\u67e5\u7406\u5b9d\u5178-\u9605\u8bfb\u6458\u62842 \uff08\u4e2a\u4eba\u53d1\u5c55\uff09", "url": "/posts/2017/book/chinese-poor-charlies-almanack-2/"}, {"date": "02/20/2017", "isodate": "2017-02-20T00:00:00-05:00", "title": "(In Chinese) \u5bcc\u7238\u7238\u7a77\u7238\u7238-\u9605\u8bfb\u6458\u6284", "url": "/posts/2017/book/chinese-rich-data-poor-dad/"}, {"date": "02/08/2017", "isodate": "2017-02-08T00:00:00-05:00", "title": "(In Chinese) \u806a\u660e\u4eba\u7528\u65b9\u683c\u7b14\u8bb0\u672c-\u9605\u8bfb\u6458\u6284", "url": "/posts/2017/book/chinese-use-graph-ruled-notebook/"}, {"date": "01/20/2017", "isodate": "2017-01-20T00:00:00-05:00", "title": "(In Chinese) \u81ea\u63a7\u529b\u9605\u8bfb\u6458\u6284 (Kindle \u5bfc\u51fa)", "url": "/posts/2017/book/chinese-zi-kong-li-highlight/"}]}], "Clean Data": [1, "/categories/clean-data/", {"posts": [{"date": "04/24/2017", "isodate": "2017-04-24T00:00:00-04:00", "title": "Meeting Notes for 'From Dirty to Decisive: Using Clean Data to Your Advantage'", "url": "/posts/2017/data%20science/meeting-notes-for-from-dirty-to-decisive-using-clean-data-to-your-advantage/"}]}], "Compass": [1, "/categories/compass/", {"posts": [{"date": "01/13/2015", "isodate": "2015-01-13T00:00:00-05:00", "title": "SASS Q&A and Tips CONTINUALLY UPDATE", "url": "/posts/2015/Front%20End/sass-qa-and-tips/"}]}], "D3.js": [8, "/categories/d3js/", {"posts": [{"date": "12/10/2014", "isodate": "2014-12-10T00:00:00-05:00", "title": "Reading Notes for D3.js Part V (Chapter 9)", "url": "/posts/2014/reading-d3-9/"}, {"date": "12/10/2014", "isodate": "2014-12-10T00:00:00-05:00", "title": "Reading Notes for D3.js Part IV (Chapter 8)", "url": "/posts/2014/reading-d3-8/"}, {"date": "12/10/2014", "isodate": "2014-12-10T00:00:00-05:00", "title": "Reading Notes for D3.js Part III (Chapter 7)", "url": "/posts/2014/reading-d3-7/"}, {"date": "12/10/2014", "isodate": "2014-12-10T00:00:00-05:00", "title": "Reading Notes for D3.js Part II (Chapter 6)", "url": "/posts/2014/reading-d3-6/"}, {"date": "12/10/2014", "isodate": "2014-12-10T00:00:00-05:00", "title": "Reading Notes for D3.js Part VIII (Chapter 12)", "url": "/posts/2014/reading-d3-12/"}, {"date": "12/10/2014", "isodate": "2014-12-10T00:00:00-05:00", "title": "Reading Notes for D3.js Part VII (Chapter 11)", "url": "/posts/2014/reading-d3-11/"}, {"date": "12/10/2014", "isodate": "2014-12-10T00:00:00-05:00", "title": "Reading Notes for D3.js Part VI (Chapter 10)", "url": "/posts/2014/reading-d3-10/"}, {"date": "12/10/2014", "isodate": "2014-12-10T00:00:00-05:00", "title": "Reading Notes for D3.js Part I (Chapter 1 to Chapter 5)", "url": "/posts/2014/reading-d3-1-to-5/"}]}], "Data": [1, "/categories/data/", {"posts": [{"date": "07/21/2015", "isodate": "2015-07-21T00:00:00-04:00", "title": "RDF Basics", "url": "/posts/2015/Others/rdf-basics/"}]}], "Data Science": [3, "/categories/data-science/", {"posts": [{"date": "08/10/2015", "isodate": "2015-08-10T00:00:00-04:00", "title": "SparkSQL Basics", "url": "/posts/2015/Data%20Science/sparksql-basics/"}, {"date": "07/21/2015", "isodate": "2015-07-21T00:00:00-04:00", "title": "Search Engine Basics (Including Lucene)", "url": "/posts/2015/Data%20Science/search-engine-basics-lucene/"}, {"date": "06/10/2015", "isodate": "2015-06-10T00:00:00-04:00", "title": "Install Apache Spark with IPython Notebook Configuration on Ubuntu 15", "url": "/posts/2015/Data%20Science/ipython-notebook-pyspark/"}]}], "Data Structure": [5, "/categories/data-structure/", {"posts": [{"date": "09/11/2015", "isodate": "2015-09-11T00:00:00-04:00", "title": "Algorithm and Data Structure Basics - Sorting", "url": "/posts/2015/Algorithm%20Data%20Structure/algorithm-and-data-structure-basics-sorting/"}, {"date": "09/03/2015", "isodate": "2015-09-03T00:00:00-04:00", "title": "Algorithm and Data Structure Basics - Heap", "url": "/posts/2015/Algorithm%20Data%20Structure/algorithm-and-data-structure-basics-heap/"}, {"date": "09/02/2015", "isodate": "2015-09-02T00:00:00-04:00", "title": "Algorithm and Data Structure Basics - Recursion", "url": "/posts/2015/Algorithm%20Data%20Structure/algorithm-and-data-structure-basics-recursion/"}, {"date": "09/02/2015", "isodate": "2015-09-02T00:00:00-04:00", "title": "Algorithm and Data Structure Basics - Linked List", "url": "/posts/2015/Algorithm%20Data%20Structure/algorithm-and-data-structure-basics-linkedlist/"}, {"date": "09/01/2015", "isodate": "2015-09-01T00:00:00-04:00", "title": "Algorithm and Data Structure Basics - Dynamic Programming", "url": "/posts/2015/Algorithm%20Data%20Structure/algorithm-and-data-structure-basics-dynamic-programming/"}]}], "Data Visualization": [1, "/categories/data-visualization/", {"posts": [{"date": "04/24/2017", "isodate": "2017-04-24T00:00:00-04:00", "title": "Meeting Notes for 'From Dirty to Decisive: Using Clean Data to Your Advantage'", "url": "/posts/2017/data%20science/meeting-notes-for-from-dirty-to-decisive-using-clean-data-to-your-advantage/"}]}], "Database": [2, "/categories/database/", {"posts": [{"date": "07/30/2015", "isodate": "2015-07-30T00:00:00-04:00", "title": "SQL Tips", "url": "/posts/2015/Data%20Science/sql-tips/"}, {"date": "06/21/2015", "isodate": "2015-06-21T00:00:00-04:00", "title": "SQL Basics", "url": "/posts/2015/Data%20Science/sql-basics/"}]}], "Digial Library": [1, "/categories/digial-library/", {"posts": [{"date": "08/09/2015", "isodate": "2015-08-09T00:00:00-04:00", "title": "Dive into Hydra and My Thoughts", "url": "/posts/2015/Others/dive-into-hydra-and-my-thoughts/"}]}], "Digital Library": [1, "/categories/digital-library/", {"posts": [{"date": "07/21/2015", "isodate": "2015-07-21T00:00:00-04:00", "title": "RDF Basics", "url": "/posts/2015/Others/rdf-basics/"}]}], "Dropdown": [1, "/categories/dropdown/", {"posts": [{"date": "06/04/2015", "isodate": "2015-06-04T00:00:00-04:00", "title": "Collection of Tips for Creating/Controlling Dropdown on Web Page", "url": "/posts/2015/JavaScript/create-controll-dropdown/"}]}], "Dynamic Programming": [1, "/categories/dynamic-programming/", {"posts": [{"date": "09/01/2015", "isodate": "2015-09-01T00:00:00-04:00", "title": "Algorithm and Data Structure Basics - Dynamic Programming", "url": "/posts/2015/Algorithm%20Data%20Structure/algorithm-and-data-structure-basics-dynamic-programming/"}]}], "English": [1, "/categories/english/", {"posts": [{"date": "06/25/2017", "isodate": "2017-06-25T00:00:00-04:00", "title": "(In Chinese) \u98ce\u683c\u7684\u8981\u7d20-\u9605\u8bfb\u6458\u6284 (The Elements of Style - Reading Note)", "url": "/posts/2017/book/chinese-the-element-of-style-reading-note/"}]}], "Excel": [1, "/categories/excel/", {"posts": [{"date": "08/23/2018", "isodate": "2018-08-23T00:00:00-04:00", "title": "(In Process)Reading Notes for \"\u522b\u6015, Excel+VBA\u5176\u5b9e\u5f88\u7b80\u5355\" Written by Excel Home", "url": "/posts/2018/business/reading-notes-for-excel-vba-hen-jian-dan/"}, {"date": "08/22/2018", "isodate": "2018-08-22T00:00:00-04:00", "title": "(In Process)Reading Notes for \"\u522b\u6015, Excel\u51fd\u6570\u5176\u5b9e\u5f88\u7b80\u5355I\" Written by Excel Home", "url": "/posts/2018/business/reading-notes-for-excel-hanshu-hen-jian-dan/"}]}], "Fedora": [1, "/categories/fedora/", {"posts": [{"date": "08/12/2015", "isodate": "2015-08-12T00:00:00-04:00", "title": "A Journal of Playing with Hydra Data", "url": "/posts/2015/Others/play-with-hydra-data/"}]}], "Finance": [6, "/categories/finance/", {"posts": [{"date": "07/25/2018", "isodate": "2018-07-25T00:00:00-04:00", "title": "(Chinese) Book Highlights for Learn To Earn\uff1aA Beginner's Guide to the Basics of Investing and Business", "url": "/posts/2018/finance/book-highlights-for-learn-to-earn/"}, {"date": "01/18/2018", "isodate": "2018-01-18T00:00:00-05:00", "title": "(In Chinese) \u5c0f\u72d7\u94b1\u94b1\u9605\u8bfb\u6458\u6284| Highlight of 'Money Oder Das 1 X 1 Des Geldes' by Bodo Shafer", "url": "/posts/2018/book/highlight-of-money-oder-das-1-X-1-des-geldes-by-bodo-shafer/"}, {"date": "05/30/2017", "isodate": "2017-05-30T00:00:00-04:00", "title": "(In Chinese) \u7a77\u67e5\u7406\u5b9d\u5178-\u9605\u8bfb\u6458\u62843\uff08\u8d22\u62a5\uff09", "url": "/posts/2017/book/chinese-poor-charlies-almanack-3/"}, {"date": "05/21/2017", "isodate": "2017-05-21T00:00:00-04:00", "title": "(In Chinese) \u7a77\u67e5\u7406\u5b9d\u5178-\u9605\u8bfb\u6458\u62841 \uff08\u4f01\u4e1a\u4e0e\u6295\u8d44\uff09", "url": "/posts/2017/book/chinese-poor-charlies-almanack-1/"}, {"date": "05/21/2017", "isodate": "2017-05-21T00:00:00-04:00", "title": "(In Chinese) \u7a77\u67e5\u7406\u5b9d\u5178-\u9605\u8bfb\u6458\u62842 \uff08\u4e2a\u4eba\u53d1\u5c55\uff09", "url": "/posts/2017/book/chinese-poor-charlies-almanack-2/"}, {"date": "02/20/2017", "isodate": "2017-02-20T00:00:00-05:00", "title": "(In Chinese) \u5bcc\u7238\u7238\u7a77\u7238\u7238-\u9605\u8bfb\u6458\u6284", "url": "/posts/2017/book/chinese-rich-data-poor-dad/"}]}], "Github": [1, "/categories/github/", {"posts": [{"date": "01/13/2015", "isodate": "2015-01-13T00:00:00-05:00", "title": "How to Build A Basic Nikola Blog and Deploy to Github Page", "url": "/posts/2015/Data%20Science/how-to-build-a-basic-nikola-blog-and-deloy-to-github-page/"}]}], "Google": [1, "/categories/google/", {"posts": [{"date": "12/10/2014", "isodate": "2014-12-10T00:00:00-05:00", "title": "Use Google Custom Search In Your Website", "url": "/posts/2014/use-google-custom-search-in-your-website/"}]}], "Graph": [1, "/categories/graph/", {"posts": [{"date": "08/01/2016", "isodate": "2016-08-01T00:00:00-04:00", "title": "SVG Study Note", "url": "/posts/2016/Front%20End/svg-study-note/"}]}], "HTML5": [4, "/categories/html5/", {"posts": [{"date": "08/16/2016", "isodate": "2016-08-16T00:00:00-04:00", "title": "Frond End Data Storage", "url": "/posts/2016/Front%20End/front-end-data-storage/"}, {"date": "07/09/2015", "isodate": "2015-07-09T00:00:00-04:00", "title": "Bootstrap 3 Sticky Footer by Martin Bean and Ryan Fait", "url": "/posts/2015/Front%20End/bootstrap3_sticky_footer/"}, {"date": "06/04/2015", "isodate": "2015-06-04T00:00:00-04:00", "title": "Collection of Tips for Creating/Controlling Dropdown on Web Page", "url": "/posts/2015/JavaScript/create-controll-dropdown/"}, {"date": "01/13/2015", "isodate": "2015-01-13T00:00:00-05:00", "title": "HTML5 Tips", "url": "/posts/2015/Front%20End/html5-tips/"}]}], "Heap": [1, "/categories/heap/", {"posts": [{"date": "09/03/2015", "isodate": "2015-09-03T00:00:00-04:00", "title": "Algorithm and Data Structure Basics - Heap", "url": "/posts/2015/Algorithm%20Data%20Structure/algorithm-and-data-structure-basics-heap/"}]}], "Hydra": [4, "/categories/hydra/", {"posts": [{"date": "08/12/2015", "isodate": "2015-08-12T00:00:00-04:00", "title": "Setting up RoR/Hydra Environment - Problems and Solutions", "url": "/posts/2015/Web%20Development%20Tips/setting-up-ror-hydra-environment-problems-and-solutions/"}, {"date": "08/12/2015", "isodate": "2015-08-12T00:00:00-04:00", "title": "A Journal of Playing with Hydra Data", "url": "/posts/2015/Others/play-with-hydra-data/"}, {"date": "08/09/2015", "isodate": "2015-08-09T00:00:00-04:00", "title": "Dive into Hydra and My Thoughts", "url": "/posts/2015/Others/dive-into-hydra-and-my-thoughts/"}, {"date": "07/21/2015", "isodate": "2015-07-21T00:00:00-04:00", "title": "Search Engine Basics (Including Lucene)", "url": "/posts/2015/Data%20Science/search-engine-basics-lucene/"}]}], "IPython": [1, "/categories/ipython/", {"posts": [{"date": "06/10/2015", "isodate": "2015-06-10T00:00:00-04:00", "title": "Install Apache Spark with IPython Notebook Configuration on Ubuntu 15", "url": "/posts/2015/Data%20Science/ipython-notebook-pyspark/"}]}], "Info Session": [1, "/categories/info-session/", {"posts": [{"date": "09/09/2018", "isodate": "2018-09-09T00:00:00-04:00", "title": "Notes for Consulting Bootcamp & First Team Presentation", "url": "/posts/2018/consulting/notes-for-consulting-bootcamp/"}]}], "JSON": [1, "/categories/json/", {"posts": [{"date": "08/13/2015", "isodate": "2015-08-13T00:00:00-04:00", "title": "Possible Ajax Error Code and Reasons", "url": "/posts/2015/JavaScript/possible-ajax-error-code-and-reasons/"}]}], "JUnit": [1, "/categories/junit/", {"posts": [{"date": "07/24/2015", "isodate": "2015-07-24T00:00:00-04:00", "title": "JUnit Basics", "url": "/posts/2015/Java/junit-basics/"}]}], "Jasmine": [1, "/categories/jasmine/", {"posts": [{"date": "08/25/2015", "isodate": "2015-08-25T00:00:00-04:00", "title": "Jasmine Basics", "url": "/posts/2015/JavaScript/jasmine-basics/"}]}], "Java": [33, "/categories/java/", {"posts": [{"date": "11/11/2015", "isodate": "2015-11-11T00:00:00-05:00", "title": "Apache Velocity Language Basics", "url": "/posts/2015/Java/apache-velocity-basics/"}, {"date": "09/11/2015", "isodate": "2015-09-11T00:00:00-04:00", "title": "Algorithm and Data Structure Basics - Sorting", "url": "/posts/2015/Algorithm%20Data%20Structure/algorithm-and-data-structure-basics-sorting/"}, {"date": "09/03/2015", "isodate": "2015-09-03T00:00:00-04:00", "title": "Algorithm and Data Structure Basics - Heap", "url": "/posts/2015/Algorithm%20Data%20Structure/algorithm-and-data-structure-basics-heap/"}, {"date": "09/02/2015", "isodate": "2015-09-02T00:00:00-04:00", "title": "Algorithm and Data Structure Basics - Recursion", "url": "/posts/2015/Algorithm%20Data%20Structure/algorithm-and-data-structure-basics-recursion/"}, {"date": "09/02/2015", "isodate": "2015-09-02T00:00:00-04:00", "title": "Algorithm and Data Structure Basics - Linked List", "url": "/posts/2015/Algorithm%20Data%20Structure/algorithm-and-data-structure-basics-linkedlist/"}, {"date": "09/01/2015", "isodate": "2015-09-01T00:00:00-04:00", "title": "Algorithm and Data Structure Basics - Dynamic Programming", "url": "/posts/2015/Algorithm%20Data%20Structure/algorithm-and-data-structure-basics-dynamic-programming/"}, {"date": "08/13/2015", "isodate": "2015-08-13T00:00:00-04:00", "title": "Possible Ajax Error Code and Reasons", "url": "/posts/2015/JavaScript/possible-ajax-error-code-and-reasons/"}, {"date": "08/05/2015", "isodate": "2015-08-05T00:00:00-04:00", "title": "RequestDispacher and Redirection in Java Web App", "url": "/posts/2015/Java/requestdispacher-redirection-in-java/"}, {"date": "08/03/2015", "isodate": "2015-08-03T00:00:00-04:00", "title": "Ajax and Java Servlet", "url": "/posts/2015/Java/ajax-and-java-servlet/"}, {"date": "07/24/2015", "isodate": "2015-07-24T00:00:00-04:00", "title": "JUnit Basics", "url": "/posts/2015/Java/junit-basics/"}, {"date": "06/16/2015", "isodate": "2015-06-16T00:00:00-04:00", "title": "Spring Tips", "url": "/posts/2015/Java/spring-tips/"}, {"date": "01/13/2015", "isodate": "2015-01-13T00:00:00-05:00", "title": "Manning OCP Java SE 7 Reading Note: Chapter 1", "url": "/posts/2015/Java/manning-ocp-java-se7-reading-note-chapter-1/"}, {"date": "01/13/2015", "isodate": "2015-01-13T00:00:00-05:00", "title": "Manning OCA Java SE 7 Reading Note: Chapter 7", "url": "/posts/2015/Java/manning-oca-java-se7-reading-note-chapter-7/"}, {"date": "01/13/2015", "isodate": "2015-01-13T00:00:00-05:00", "title": "Manning OCA Java SE 7 Reading Note: Chapter 6", "url": "/posts/2015/Java/manning-oca-java-se7-reading-note-chapter-6/"}, {"date": "01/13/2015", "isodate": "2015-01-13T00:00:00-05:00", "title": "Manning OCA Java SE 7 Reading Note: Chapter 5", "url": "/posts/2015/Java/manning-oca-java-se7-reading-note-chapter-5/"}, {"date": "01/13/2015", "isodate": "2015-01-13T00:00:00-05:00", "title": "Manning OCA Java SE 7 Reading Note: Chapter 4", "url": "/posts/2015/Java/manning-oca-java-se7-reading-note-chapter-4/"}, {"date": "01/13/2015", "isodate": "2015-01-13T00:00:00-05:00", "title": "Manning OCA Java SE 7 Reading Note: Chapter 3", "url": "/posts/2015/Java/manning-oca-java-se7-reading-note-chapter-3/"}, {"date": "01/13/2015", "isodate": "2015-01-13T00:00:00-05:00", "title": "Manning OCA Java SE 7 Reading Note: Chapter 2", "url": "/posts/2015/Java/manning-oca-java-se7-reading-note-chapter-2/"}, {"date": "01/13/2015", "isodate": "2015-01-13T00:00:00-05:00", "title": "Manning OCA Java SE 7 Reading Note: Chapter 1", "url": "/posts/2015/Java/manning-oca-java-se7-reading-note-chapter-1/"}, {"date": "01/13/2015", "isodate": "2015-01-13T00:00:00-05:00", "title": "Important Q&A for OCA Java SE7 Certification Guide", "url": "/posts/2015/Java/key-qas-for-oca-book/"}, {"date": "01/13/2015", "isodate": "2015-01-13T00:00:00-05:00", "title": "JSTL Reference Sheet", "url": "/posts/2015/Java/jstl-reference-sheet/"}, {"date": "01/13/2015", "isodate": "2015-01-13T00:00:00-05:00", "title": "Java Knowledge: HashCode", "url": "/posts/2015/Java/java-knowledge-hashcode/"}, {"date": "01/13/2015", "isodate": "2015-01-13T00:00:00-05:00", "title": "Java Knowledge: Enum", "url": "/posts/2015/Java/java-knowledge-enum/"}, {"date": "01/13/2015", "isodate": "2015-01-13T00:00:00-05:00", "title": "Ajax and Spring MVC Controller", "url": "/posts/2015/Java/ajax-and-spring-mvc-controller/"}, {"date": "01/13/2015", "isodate": "2015-01-13T00:00:00-05:00", "title": "Reading Note for Andorid Development Guide Part I", "url": "/posts/2014/reading-note-android-I/"}, {"date": "12/10/2014", "isodate": "2014-12-10T00:00:00-05:00", "title": "Use Java to Get Client's IP Address", "url": "/posts/2014/use-java-to-get-clients-ip-address/"}, {"date": "12/10/2014", "isodate": "2014-12-10T00:00:00-05:00", "title": "Reading Notes for Spring 3 Core Components Tutorial Part VI (Chapter 22)", "url": "/posts/2014/reading-spring-3-22/"}, {"date": "12/10/2014", "isodate": "2014-12-10T00:00:00-05:00", "title": "Reading Notes for Spring 3 Core Components Tutorial Part VII (Chapter 21)", "url": "/posts/2014/reading-spring-3-21/"}, {"date": "12/10/2014", "isodate": "2014-12-10T00:00:00-05:00", "title": "Reading Notes for Spring 3 Core Components Tutorial Part V (Chapter 20)", "url": "/posts/2014/reading-spring-3-20/"}, {"date": "12/10/2014", "isodate": "2014-12-10T00:00:00-05:00", "title": "Reading Notes for Spring 3 Core Components Tutorial Part I Part IV (Chapter 17 to Chapter 19)", "url": "/posts/2014/reading-spring-3-17-to-19/"}, {"date": "12/10/2014", "isodate": "2014-12-10T00:00:00-05:00", "title": "Reading Notes for Spring 3 Core Components Tutorial Part Part III (Chapter 14 to Chapter 16)", "url": "/posts/2014/reading-spring-3-14-to-16/"}, {"date": "12/10/2014", "isodate": "2014-12-10T00:00:00-05:00", "title": "Reading Notes for Spring 3 Core Components Tutorial Part II (Chapter 11 to Chapter 13)", "url": "/posts/2014/reading-spring-3-11-to-13/"}, {"date": "12/10/2014", "isodate": "2014-12-10T00:00:00-05:00", "title": "Reading Notes for Spring 3 Core Components Tutorial Part I (Chapter 1 to Chapter 10)", "url": "/posts/2014/reading-spring-3-1-to-10/"}]}], "JavaScript": [27, "/categories/javascript/", {"posts": [{"date": "12/16/2016", "isodate": "2016-12-16T00:00:00-05:00", "title": "A Brief Introduction of JWT (JavaScript Web Token)", "url": "/posts/2016/JavaScript/a-brief-introduction-of-jwt/"}, {"date": "08/16/2016", "isodate": "2016-08-16T00:00:00-04:00", "title": "Frond End Data Storage", "url": "/posts/2016/Front%20End/front-end-data-storage/"}, {"date": "06/22/2016", "isodate": "2016-06-22T00:00:00-04:00", "title": "Reading Note - JavaScript Scoping, Hoisting and Others", "url": "/posts/2016/JavaScript/reading-note-javascript-scoping-hoisting-and-others/"}, {"date": "05/17/2016", "isodate": "2016-05-17T00:00:00-04:00", "title": "Reading Note - Asynchronous in jQuery and ECMAScript 6", "url": "/posts/2016/JavaScript/reading_note_defer_in_jquery/"}, {"date": "09/22/2015", "isodate": "2015-09-22T00:00:00-04:00", "title": "Number Precision in JavaScript", "url": "/posts/2015/JavaScript/number-precision-in-javascript/"}, {"date": "08/25/2015", "isodate": "2015-08-25T00:00:00-04:00", "title": "Jasmine Basics", "url": "/posts/2015/JavaScript/jasmine-basics/"}, {"date": "08/20/2015", "isodate": "2015-08-20T00:00:00-04:00", "title": "Regular Expression", "url": "/posts/2015/Web%20Development%20Tips/regular-expression/"}, {"date": "08/17/2015", "isodate": "2015-08-17T00:00:00-04:00", "title": "JavaScript Tips", "url": "/posts/2015/JavaScript/javascript-tips/"}, {"date": "08/11/2015", "isodate": "2015-08-11T00:00:00-04:00", "title": "AngularJS Basics", "url": "/posts/2015/JavaScript/angularjs-basics/"}, {"date": "07/10/2015", "isodate": "2015-07-10T00:00:00-04:00", "title": "JavaScript Object and JSON", "url": "/posts/2015/JavaScript/javascript-object-and-json/"}, {"date": "07/09/2015", "isodate": "2015-07-09T00:00:00-04:00", "title": "Bootstrap 3 Sticky Footer by Martin Bean and Ryan Fait", "url": "/posts/2015/Front%20End/bootstrap3_sticky_footer/"}, {"date": "07/02/2015", "isodate": "2015-07-02T00:00:00-04:00", "title": "JavaScript and Color", "url": "/posts/2015/JavaScript/javascript-color/"}, {"date": "06/04/2015", "isodate": "2015-06-04T00:00:00-04:00", "title": "Collection of Tips for Creating/Controlling Dropdown on Web Page", "url": "/posts/2015/JavaScript/create-controll-dropdown/"}, {"date": "01/13/2015", "isodate": "2015-01-13T00:00:00-05:00", "title": "Window.Location Property", "url": "/posts/2015/JavaScript/window-location-property/"}, {"date": "01/13/2015", "isodate": "2015-01-13T00:00:00-05:00", "title": "JavaScript Library Experience: FullCalendar", "url": "/posts/2015/JavaScript/javascript-library-experience-fullcalendar/"}, {"date": "01/13/2015", "isodate": "2015-01-13T00:00:00-05:00", "title": "Boostrap3 Date Picker", "url": "/posts/2015/JavaScript/bootstrap3-date-picker/"}, {"date": "01/13/2015", "isodate": "2015-01-13T00:00:00-05:00", "title": "HTML5 Tips", "url": "/posts/2015/Front%20End/html5-tips/"}, {"date": "12/10/2014", "isodate": "2014-12-10T00:00:00-05:00", "title": "Bootstrap3 Tips CONTINUALLY UPDATE", "url": "/posts/2015/Front%20End/bootstrap3-tricks/"}, {"date": "12/10/2014", "isodate": "2014-12-10T00:00:00-05:00", "title": "Reading Notes for D3.js Part V (Chapter 9)", "url": "/posts/2014/reading-d3-9/"}, {"date": "12/10/2014", "isodate": "2014-12-10T00:00:00-05:00", "title": "Reading Notes for D3.js Part IV (Chapter 8)", "url": "/posts/2014/reading-d3-8/"}, {"date": "12/10/2014", "isodate": "2014-12-10T00:00:00-05:00", "title": "Reading Notes for D3.js Part III (Chapter 7)", "url": "/posts/2014/reading-d3-7/"}, {"date": "12/10/2014", "isodate": "2014-12-10T00:00:00-05:00", "title": "Reading Notes for D3.js Part II (Chapter 6)", "url": "/posts/2014/reading-d3-6/"}, {"date": "12/10/2014", "isodate": "2014-12-10T00:00:00-05:00", "title": "Reading Notes for D3.js Part VIII (Chapter 12)", "url": "/posts/2014/reading-d3-12/"}, {"date": "12/10/2014", "isodate": "2014-12-10T00:00:00-05:00", "title": "Reading Notes for D3.js Part VII (Chapter 11)", "url": "/posts/2014/reading-d3-11/"}, {"date": "12/10/2014", "isodate": "2014-12-10T00:00:00-05:00", "title": "Reading Notes for D3.js Part VI (Chapter 10)", "url": "/posts/2014/reading-d3-10/"}, {"date": "12/10/2014", "isodate": "2014-12-10T00:00:00-05:00", "title": "Reading Notes for D3.js Part I (Chapter 1 to Chapter 5)", "url": "/posts/2014/reading-d3-1-to-5/"}, {"date": "12/10/2014", "isodate": "2014-12-10T00:00:00-05:00", "title": "jQuery Tutorial Reading Notes", "url": "/posts/2014/jquery-tutorial-reading-notes/"}, {"date": "12/10/2014", "isodate": "2014-12-10T00:00:00-05:00", "title": "Bootstrap3 API Reading Notes", "url": "/posts/2014/bootstrap3-api-reading-notes/"}]}], "Linked List": [1, "/categories/linked-list/", {"posts": [{"date": "09/02/2015", "isodate": "2015-09-02T00:00:00-04:00", "title": "Algorithm and Data Structure Basics - Linked List", "url": "/posts/2015/Algorithm%20Data%20Structure/algorithm-and-data-structure-basics-linkedlist/"}]}], "Linux": [4, "/categories/linux/", {"posts": [{"date": "08/12/2015", "isodate": "2015-08-12T00:00:00-04:00", "title": "Setting up RoR/Hydra Environment - Problems and Solutions", "url": "/posts/2015/Web%20Development%20Tips/setting-up-ror-hydra-environment-problems-and-solutions/"}, {"date": "08/01/2015", "isodate": "2015-08-01T00:00:00-04:00", "title": "Ubuntu Tips", "url": "/posts/2015/Linux/ubuntu-tips/"}, {"date": "01/13/2015", "isodate": "2015-01-13T00:00:00-05:00", "title": "Comparation of Ubuntu14, Linux Mint17 Cinnamon and CentOS7, from a Linux Beginner", "url": "/posts/2014/linux-comparation/"}, {"date": "01/13/2015", "isodate": "2015-01-13T00:00:00-05:00", "title": "Install Ubuntu 14 on External Drive from Windows8 Machine with Node.js, Hexo and Jekyll", "url": "/posts/2014/install-ubuntu-on-windows-8-machine/"}]}], "Make Profit": [1, "/categories/make-profit/", {"posts": [{"date": "09/14/2018", "isodate": "2018-09-14T00:00:00-04:00", "title": "(Updating) Consulting Tookit - Make Profit", "url": "/posts/2018/consulting/consulting-toolkit-make-profit/"}]}], "Make Proft": [1, "/categories/make-proft/", {"posts": [{"date": "09/14/2018", "isodate": "2018-09-14T00:00:00-04:00", "title": "Case of Make Profit - Berkley 2006 5.13. Bicycle Manufacturer", "url": "/posts/2018/consulting/case-of-make-profit-berkley-bicyle-manufacturer/"}]}], "Math": [1, "/categories/math/", {"posts": [{"date": "01/31/2018", "isodate": "2018-01-31T00:00:00-05:00", "title": "(In Chinese) \u6392\u5217\u7ec4\u5408\u7b80\u5355\u7b14\u8bb0/A hand-writing brief note about permutation and combination", "url": "/posts/2018/math/chinese-permutation-combination-brief-note/"}]}], "Meeting Notes": [1, "/categories/meeting-notes/", {"posts": [{"date": "04/24/2017", "isodate": "2017-04-24T00:00:00-04:00", "title": "Meeting Notes for 'From Dirty to Decisive: Using Clean Data to Your Advantage'", "url": "/posts/2017/data%20science/meeting-notes-for-from-dirty-to-decisive-using-clean-data-to-your-advantage/"}]}], "Nikola": [1, "/categories/nikola/", {"posts": [{"date": "01/13/2015", "isodate": "2015-01-13T00:00:00-05:00", "title": "How to Build A Basic Nikola Blog and Deploy to Github Page", "url": "/posts/2015/Data%20Science/how-to-build-a-basic-nikola-blog-and-deloy-to-github-page/"}]}], "Node.js": [1, "/categories/nodejs/", {"posts": [{"date": "05/25/2016", "isodate": "2016-05-25T00:00:00-04:00", "title": "Node.js Basics", "url": "/posts/2016/JavaScript/node-js-basics/"}]}], "Note Taking": [3, "/categories/note-taking/", {"posts": [{"date": "01/31/2018", "isodate": "2018-01-31T00:00:00-05:00", "title": "(In Chinese) \u6392\u5217\u7ec4\u5408\u7b80\u5355\u7b14\u8bb0/A hand-writing brief note about permutation and combination", "url": "/posts/2018/math/chinese-permutation-combination-brief-note/"}, {"date": "10/08/2017", "isodate": "2017-10-08T00:00:00-04:00", "title": "(Chinese) Kindle Highlights for \u8aad\u66f8\u306f1\u518a\u306e\u30ce\u30fc\u30c8\u306b\u307e\u3068\u3081\u306a\u3055\u3044 (How to read a book effectively) by \u5965\u91ce\u5ba3\u4e4b", "url": "/posts/2017/book/kindle-hightlights-for-how-to-read-a-book-effectively/"}, {"date": "02/08/2017", "isodate": "2017-02-08T00:00:00-05:00", "title": "(In Chinese) \u806a\u660e\u4eba\u7528\u65b9\u683c\u7b14\u8bb0\u672c-\u9605\u8bfb\u6458\u6284", "url": "/posts/2017/book/chinese-use-graph-ruled-notebook/"}]}], "OOP": [1, "/categories/oop/", {"posts": [{"date": "06/18/2017", "isodate": "2017-06-18T00:00:00-04:00", "title": "Object Oriented Programming in Professional JavaScript for Web Developers", "url": "/posts/2017/front-end/professional-javascript-oop/"}]}], "Operating System": [2, "/categories/operating-system/", {"posts": [{"date": "01/13/2015", "isodate": "2015-01-13T00:00:00-05:00", "title": "Comparation of Ubuntu14, Linux Mint17 Cinnamon and CentOS7, from a Linux Beginner", "url": "/posts/2014/linux-comparation/"}, {"date": "01/13/2015", "isodate": "2015-01-13T00:00:00-05:00", "title": "Install Ubuntu 14 on External Drive from Windows8 Machine with Node.js, Hexo and Jekyll", "url": "/posts/2014/install-ubuntu-on-windows-8-machine/"}]}], "Presentation": [2, "/categories/presentation/", {"posts": [{"date": "09/16/2018", "isodate": "2018-09-16T00:00:00-04:00", "title": "(Updating) How to Present a Case", "url": "/posts/2018/business/how-to-present-a-case/"}, {"date": "07/12/2018", "isodate": "2018-07-12T00:00:00-04:00", "title": "Reading Map for Say It With Charts & Presentations", "url": "/posts/2018/business/reading-map-for-say-it-with-chartspresentations/"}]}], "Python": [3, "/categories/python/", {"posts": [{"date": "06/10/2015", "isodate": "2015-06-10T00:00:00-04:00", "title": "Install Apache Spark with IPython Notebook Configuration on Ubuntu 15", "url": "/posts/2015/Data%20Science/ipython-notebook-pyspark/"}, {"date": "01/13/2015", "isodate": "2015-01-13T00:00:00-05:00", "title": "Use Amazon EC2 to Host IPython Notebook", "url": "/posts/2015/Data%20Science/use-amazon-ec2-to-host-ipython-notebook/"}, {"date": "01/13/2015", "isodate": "2015-01-13T00:00:00-05:00", "title": "How to Build A Basic Nikola Blog and Deploy to Github Page", "url": "/posts/2015/Data%20Science/how-to-build-a-basic-nikola-blog-and-deloy-to-github-page/"}]}], "Reading Notes": [22, "/categories/reading-notes/", {"posts": [{"date": "09/11/2018", "isodate": "2018-09-11T00:00:00-04:00", "title": "Reading Notes for Case Interview Secrets Part 3/4", "url": "/posts/2018/consulting/notes-for-case-interview-secrets-3-4/"}, {"date": "08/29/2018", "isodate": "2018-08-29T00:00:00-04:00", "title": "Chapter 2 of Case in Point: Graph Analysis for Consulting and Case Interviews, written by Marc P. Cosentino Mukund Jain", "url": "/posts/2018/consulting/chapter-2-of-case-in-point-graph-analysis/"}, {"date": "08/27/2018", "isodate": "2018-08-27T00:00:00-04:00", "title": "Reading Notes for \"The McKinsey Mind\" written by Ethan M. Rasiel and Paul N. Friga", "url": "/posts/2018/consulting/reading-note-for-the-mckinsey-way/"}, {"date": "08/23/2018", "isodate": "2018-08-23T00:00:00-04:00", "title": "(In Process)Reading Notes for \"\u522b\u6015, Excel+VBA\u5176\u5b9e\u5f88\u7b80\u5355\" Written by Excel Home", "url": "/posts/2018/business/reading-notes-for-excel-vba-hen-jian-dan/"}, {"date": "08/22/2018", "isodate": "2018-08-22T00:00:00-04:00", "title": "(In Process)Reading Notes for \"\u522b\u6015, Excel\u51fd\u6570\u5176\u5b9e\u5f88\u7b80\u5355I\" Written by Excel Home", "url": "/posts/2018/business/reading-notes-for-excel-hanshu-hen-jian-dan/"}, {"date": "07/25/2018", "isodate": "2018-07-25T00:00:00-04:00", "title": "(Chinese) Book Highlights for Learn To Earn\uff1aA Beginner's Guide to the Basics of Investing and Business", "url": "/posts/2018/finance/book-highlights-for-learn-to-earn/"}, {"date": "07/17/2018", "isodate": "2018-07-17T00:00:00-04:00", "title": "Reading Map for CASE IN POINT, Chapter 1 to 5, written by Marc P. Cosentino", "url": "/posts/2018/consulting/reading-map-for-case-in-point-chapter-1-to-5/"}, {"date": "07/12/2018", "isodate": "2018-07-12T00:00:00-04:00", "title": "Reading Map for Say It With Charts & Presentations", "url": "/posts/2018/business/reading-map-for-say-it-with-chartspresentations/"}, {"date": "07/11/2018", "isodate": "2018-07-11T00:00:00-04:00", "title": "(Chinese) Highlights for Fully Engaged! Using the Practicing Mind in Daily Life written by Thomas M. Sterner", "url": "/posts/2018/book/highlights-for-fully-engaged/"}, {"date": "07/10/2018", "isodate": "2018-07-10T00:00:00-04:00", "title": "(Chinese) Highlights for \u79c1\u306f\u3044\u304f\u3089?(\u7cbe\u51c6\u52aa\u529b) written by Mahito Noguchi(\u91ce\u53e3\u771f\u4eba)", "url": "/posts/2018/book/highlights-for-jingzhunmuli/"}, {"date": "07/06/2018", "isodate": "2018-07-06T00:00:00-04:00", "title": "(Chinese) Highlights for \u201cScarcity: Why Having Too Little Means So Much\u201d by Sendhil Mullainathan & Elddar Shafir", "url": "/posts/2018/book/highlights-for-scarcity/"}, {"date": "04/17/2018", "isodate": "2018-04-17T00:00:00-04:00", "title": "Reading Notes for CFA1 Program Curriculum Volume 1 - QUANTITATIVE METHODS part", "url": "/posts/2018/finance/cfa-reading-notes-1/"}, {"date": "03/18/2018", "isodate": "2018-03-18T00:00:00-04:00", "title": "(Chinese) Highlights for \u201cThe Minto Pyramid Principle: Logic in Writing, Thinking, & Problem Solving/\u91d1\u5b57\u5854\u539f\u7406\u201d by Barbara Minto", "url": "/posts/2018/business/hightlights-for-the-minto-pyramid-principle/"}, {"date": "01/18/2018", "isodate": "2018-01-18T00:00:00-05:00", "title": "(In Chinese) \u5c0f\u72d7\u94b1\u94b1\u9605\u8bfb\u6458\u6284| Highlight of 'Money Oder Das 1 X 1 Des Geldes' by Bodo Shafer", "url": "/posts/2018/book/highlight-of-money-oder-das-1-X-1-des-geldes-by-bodo-shafer/"}, {"date": "10/08/2017", "isodate": "2017-10-08T00:00:00-04:00", "title": "(Chinese) Kindle Highlights for \u8aad\u66f8\u306f1\u518a\u306e\u30ce\u30fc\u30c8\u306b\u307e\u3068\u3081\u306a\u3055\u3044 (How to read a book effectively) by \u5965\u91ce\u5ba3\u4e4b", "url": "/posts/2017/book/kindle-hightlights-for-how-to-read-a-book-effectively/"}, {"date": "06/25/2017", "isodate": "2017-06-25T00:00:00-04:00", "title": "(In Chinese) \u98ce\u683c\u7684\u8981\u7d20-\u9605\u8bfb\u6458\u6284 (The Elements of Style - Reading Note)", "url": "/posts/2017/book/chinese-the-element-of-style-reading-note/"}, {"date": "06/18/2017", "isodate": "2017-06-18T00:00:00-04:00", "title": "Object Oriented Programming in Professional JavaScript for Web Developers", "url": "/posts/2017/front-end/professional-javascript-oop/"}, {"date": "05/30/2017", "isodate": "2017-05-30T00:00:00-04:00", "title": "(In Chinese) \u7a77\u67e5\u7406\u5b9d\u5178-\u9605\u8bfb\u6458\u62843\uff08\u8d22\u62a5\uff09", "url": "/posts/2017/book/chinese-poor-charlies-almanack-3/"}, {"date": "05/21/2017", "isodate": "2017-05-21T00:00:00-04:00", "title": "(In Chinese) \u7a77\u67e5\u7406\u5b9d\u5178-\u9605\u8bfb\u6458\u62841 \uff08\u4f01\u4e1a\u4e0e\u6295\u8d44\uff09", "url": "/posts/2017/book/chinese-poor-charlies-almanack-1/"}, {"date": "05/21/2017", "isodate": "2017-05-21T00:00:00-04:00", "title": "(In Chinese) \u7a77\u67e5\u7406\u5b9d\u5178-\u9605\u8bfb\u6458\u62842 \uff08\u4e2a\u4eba\u53d1\u5c55\uff09", "url": "/posts/2017/book/chinese-poor-charlies-almanack-2/"}, {"date": "02/20/2017", "isodate": "2017-02-20T00:00:00-05:00", "title": "(In Chinese) \u5bcc\u7238\u7238\u7a77\u7238\u7238-\u9605\u8bfb\u6458\u6284", "url": "/posts/2017/book/chinese-rich-data-poor-dad/"}, {"date": "02/08/2017", "isodate": "2017-02-08T00:00:00-05:00", "title": "(In Chinese) \u806a\u660e\u4eba\u7528\u65b9\u683c\u7b14\u8bb0\u672c-\u9605\u8bfb\u6458\u6284", "url": "/posts/2017/book/chinese-use-graph-ruled-notebook/"}, {"date": "01/20/2017", "isodate": "2017-01-20T00:00:00-05:00", "title": "(In Chinese) \u81ea\u63a7\u529b\u9605\u8bfb\u6458\u6284 (Kindle \u5bfc\u51fa)", "url": "/posts/2017/book/chinese-zi-kong-li-highlight/"}]}], "Recursion": [1, "/categories/recursion/", {"posts": [{"date": "09/02/2015", "isodate": "2015-09-02T00:00:00-04:00", "title": "Algorithm and Data Structure Basics - Recursion", "url": "/posts/2015/Algorithm%20Data%20Structure/algorithm-and-data-structure-basics-recursion/"}]}], "Research": [1, "/categories/research/", {"posts": [{"date": "07/21/2015", "isodate": "2015-07-21T00:00:00-04:00", "title": "RDF Basics", "url": "/posts/2015/Others/rdf-basics/"}]}], "Ruby on Rails": [1, "/categories/ruby-on-rails/", {"posts": [{"date": "08/12/2015", "isodate": "2015-08-12T00:00:00-04:00", "title": "Setting up RoR/Hydra Environment - Problems and Solutions", "url": "/posts/2015/Web%20Development%20Tips/setting-up-ror-hydra-environment-problems-and-solutions/"}]}], "SASS": [1, "/categories/sass/", {"posts": [{"date": "01/13/2015", "isodate": "2015-01-13T00:00:00-05:00", "title": "SASS Q&A and Tips CONTINUALLY UPDATE", "url": "/posts/2015/Front%20End/sass-qa-and-tips/"}]}], "SEO": [1, "/categories/seo/", {"posts": [{"date": "07/21/2015", "isodate": "2015-07-21T00:00:00-04:00", "title": "Search Engine Basics (Including Lucene)", "url": "/posts/2015/Data%20Science/search-engine-basics-lucene/"}]}], "SQL": [2, "/categories/sql/", {"posts": [{"date": "07/30/2015", "isodate": "2015-07-30T00:00:00-04:00", "title": "SQL Tips", "url": "/posts/2015/Data%20Science/sql-tips/"}, {"date": "06/21/2015", "isodate": "2015-06-21T00:00:00-04:00", "title": "SQL Basics", "url": "/posts/2015/Data%20Science/sql-basics/"}]}], "Search Engine": [2, "/categories/search-engine/", {"posts": [{"date": "07/21/2015", "isodate": "2015-07-21T00:00:00-04:00", "title": "RDF Basics", "url": "/posts/2015/Others/rdf-basics/"}, {"date": "07/21/2015", "isodate": "2015-07-21T00:00:00-04:00", "title": "Search Engine Basics (Including Lucene)", "url": "/posts/2015/Data%20Science/search-engine-basics-lucene/"}]}], "Self-Improvement": [4, "/categories/self-improvement/", {"posts": [{"date": "07/11/2018", "isodate": "2018-07-11T00:00:00-04:00", "title": "(Chinese) Highlights for Fully Engaged! Using the Practicing Mind in Daily Life written by Thomas M. Sterner", "url": "/posts/2018/book/highlights-for-fully-engaged/"}, {"date": "07/10/2018", "isodate": "2018-07-10T00:00:00-04:00", "title": "(Chinese) Highlights for \u79c1\u306f\u3044\u304f\u3089?(\u7cbe\u51c6\u52aa\u529b) written by Mahito Noguchi(\u91ce\u53e3\u771f\u4eba)", "url": "/posts/2018/book/highlights-for-jingzhunmuli/"}, {"date": "07/06/2018", "isodate": "2018-07-06T00:00:00-04:00", "title": "(Chinese) Highlights for \u201cScarcity: Why Having Too Little Means So Much\u201d by Sendhil Mullainathan & Elddar Shafir", "url": "/posts/2018/book/highlights-for-scarcity/"}, {"date": "07/05/2018", "isodate": "2018-07-05T00:00:00-04:00", "title": "Reading Map for WHAT SMART STUDENT KNOW by Aadam Robinson & MIND MAP BOOK by Tony Buzan", "url": "/posts/2018/business/reading-map-for-what-smart-student-know-and-mind-map-book/"}]}], "Servlet": [2, "/categories/servlet/", {"posts": [{"date": "08/05/2015", "isodate": "2015-08-05T00:00:00-04:00", "title": "RequestDispacher and Redirection in Java Web App", "url": "/posts/2015/Java/requestdispacher-redirection-in-java/"}, {"date": "08/03/2015", "isodate": "2015-08-03T00:00:00-04:00", "title": "Ajax and Java Servlet", "url": "/posts/2015/Java/ajax-and-java-servlet/"}]}], "Software Testing": [2, "/categories/software-testing/", {"posts": [{"date": "08/25/2015", "isodate": "2015-08-25T00:00:00-04:00", "title": "Jasmine Basics", "url": "/posts/2015/JavaScript/jasmine-basics/"}, {"date": "07/24/2015", "isodate": "2015-07-24T00:00:00-04:00", "title": "JUnit Basics", "url": "/posts/2015/Java/junit-basics/"}]}], "Solr": [1, "/categories/solr/", {"posts": [{"date": "08/12/2015", "isodate": "2015-08-12T00:00:00-04:00", "title": "A Journal of Playing with Hydra Data", "url": "/posts/2015/Others/play-with-hydra-data/"}]}], "Sorting": [1, "/categories/sorting/", {"posts": [{"date": "09/11/2015", "isodate": "2015-09-11T00:00:00-04:00", "title": "Algorithm and Data Structure Basics - Sorting", "url": "/posts/2015/Algorithm%20Data%20Structure/algorithm-and-data-structure-basics-sorting/"}]}], "Spark": [2, "/categories/spark/", {"posts": [{"date": "08/10/2015", "isodate": "2015-08-10T00:00:00-04:00", "title": "SparkSQL Basics", "url": "/posts/2015/Data%20Science/sparksql-basics/"}, {"date": "06/10/2015", "isodate": "2015-06-10T00:00:00-04:00", "title": "Install Apache Spark with IPython Notebook Configuration on Ubuntu 15", "url": "/posts/2015/Data%20Science/ipython-notebook-pyspark/"}]}], "Spring": [2, "/categories/spring/", {"posts": [{"date": "06/16/2015", "isodate": "2015-06-16T00:00:00-04:00", "title": "Spring Tips", "url": "/posts/2015/Java/spring-tips/"}, {"date": "01/13/2015", "isodate": "2015-01-13T00:00:00-05:00", "title": "Ajax and Spring MVC Controller", "url": "/posts/2015/Java/ajax-and-spring-mvc-controller/"}]}], "Spring MVC": [1, "/categories/spring-mvc/", {"posts": [{"date": "08/13/2015", "isodate": "2015-08-13T00:00:00-04:00", "title": "Possible Ajax Error Code and Reasons", "url": "/posts/2015/JavaScript/possible-ajax-error-code-and-reasons/"}]}], "Tool Kit": [1, "/categories/tool-kit/", {"posts": [{"date": "09/14/2018", "isodate": "2018-09-14T00:00:00-04:00", "title": "(Updating) Consulting Tookit - Make Profit", "url": "/posts/2018/consulting/consulting-toolkit-make-profit/"}]}], "TypeScript": [1, "/categories/typescript/", {"posts": [{"date": "06/21/2016", "isodate": "2016-06-21T00:00:00-04:00", "title": "TypeScript Basics", "url": "/posts/2016/JavaScript/typescript-basics/"}]}], "Ubuntu": [2, "/categories/ubuntu/", {"posts": [{"date": "08/12/2015", "isodate": "2015-08-12T00:00:00-04:00", "title": "Setting up RoR/Hydra Environment - Problems and Solutions", "url": "/posts/2015/Web%20Development%20Tips/setting-up-ror-hydra-environment-problems-and-solutions/"}, {"date": "08/01/2015", "isodate": "2015-08-01T00:00:00-04:00", "title": "Ubuntu Tips", "url": "/posts/2015/Linux/ubuntu-tips/"}]}], "Velocity": [1, "/categories/velocity/", {"posts": [{"date": "11/11/2015", "isodate": "2015-11-11T00:00:00-05:00", "title": "Apache Velocity Language Basics", "url": "/posts/2015/Java/apache-velocity-basics/"}]}], "Web Developement Tips": [1, "/categories/web-developement-tips/", {"posts": [{"date": "12/10/2014", "isodate": "2014-12-10T00:00:00-05:00", "title": "Use Google Custom Search In Your Website", "url": "/posts/2014/use-google-custom-search-in-your-website/"}]}], "Web Worker": [1, "/categories/web-worker/", {"posts": [{"date": "08/17/2016", "isodate": "2016-08-17T00:00:00-04:00", "title": "Web Worker Study Note", "url": "/posts/2016/JavaScript/web-worker-study-note/"}]}], "Willpower": [1, "/categories/willpower/", {"posts": [{"date": "01/20/2017", "isodate": "2017-01-20T00:00:00-05:00", "title": "(In Chinese) \u81ea\u63a7\u529b\u9605\u8bfb\u6458\u6284 (Kindle \u5bfc\u51fa)", "url": "/posts/2017/book/chinese-zi-kong-li-highlight/"}]}], "Writing": [2, "/categories/writing/", {"posts": [{"date": "03/18/2018", "isodate": "2018-03-18T00:00:00-04:00", "title": "(Chinese) Highlights for \u201cThe Minto Pyramid Principle: Logic in Writing, Thinking, & Problem Solving/\u91d1\u5b57\u5854\u539f\u7406\u201d by Barbara Minto", "url": "/posts/2018/business/hightlights-for-the-minto-pyramid-principle/"}, {"date": "06/25/2017", "isodate": "2017-06-25T00:00:00-04:00", "title": "(In Chinese) \u98ce\u683c\u7684\u8981\u7d20-\u9605\u8bfb\u6458\u6284 (The Elements of Style - Reading Note)", "url": "/posts/2017/book/chinese-the-element-of-style-reading-note/"}]}], "jQuery": [13, "/categories/jquery/", {"posts": [{"date": "05/17/2016", "isodate": "2016-05-17T00:00:00-04:00", "title": "Reading Note - Asynchronous in jQuery and ECMAScript 6", "url": "/posts/2016/JavaScript/reading_note_defer_in_jquery/"}, {"date": "08/25/2015", "isodate": "2015-08-25T00:00:00-04:00", "title": "Jasmine Basics", "url": "/posts/2015/JavaScript/jasmine-basics/"}, {"date": "08/17/2015", "isodate": "2015-08-17T00:00:00-04:00", "title": "JavaScript Tips", "url": "/posts/2015/JavaScript/javascript-tips/"}, {"date": "08/13/2015", "isodate": "2015-08-13T00:00:00-04:00", "title": "Possible Ajax Error Code and Reasons", "url": "/posts/2015/JavaScript/possible-ajax-error-code-and-reasons/"}, {"date": "08/03/2015", "isodate": "2015-08-03T00:00:00-04:00", "title": "Ajax and Java Servlet", "url": "/posts/2015/Java/ajax-and-java-servlet/"}, {"date": "07/10/2015", "isodate": "2015-07-10T00:00:00-04:00", "title": "JavaScript Object and JSON", "url": "/posts/2015/JavaScript/javascript-object-and-json/"}, {"date": "06/04/2015", "isodate": "2015-06-04T00:00:00-04:00", "title": "Collection of Tips for Creating/Controlling Dropdown on Web Page", "url": "/posts/2015/JavaScript/create-controll-dropdown/"}, {"date": "01/13/2015", "isodate": "2015-01-13T00:00:00-05:00", "title": "JavaScript Library Experience: FullCalendar", "url": "/posts/2015/JavaScript/javascript-library-experience-fullcalendar/"}, {"date": "01/13/2015", "isodate": "2015-01-13T00:00:00-05:00", "title": "Ajax and Spring MVC Controller", "url": "/posts/2015/Java/ajax-and-spring-mvc-controller/"}, {"date": "01/13/2015", "isodate": "2015-01-13T00:00:00-05:00", "title": "HTML5 Tips", "url": "/posts/2015/Front%20End/html5-tips/"}, {"date": "12/10/2014", "isodate": "2014-12-10T00:00:00-05:00", "title": "Bootstrap3 Tips CONTINUALLY UPDATE", "url": "/posts/2015/Front%20End/bootstrap3-tricks/"}, {"date": "12/10/2014", "isodate": "2014-12-10T00:00:00-05:00", "title": "jQuery Tutorial Reading Notes", "url": "/posts/2014/jquery-tutorial-reading-notes/"}, {"date": "12/10/2014", "isodate": "2014-12-10T00:00:00-05:00", "title": "Bootstrap3 API Reading Notes", "url": "/posts/2014/bootstrap3-api-reading-notes/"}]}]}